show_name,show_id,season,episode_num,episode_name,original_air_date,synopsis
Boy Meets World,13,4,9,Sixteen Candles and Four-Hundred-Pound Men,1996-11-15,Cory must help Frankie with his father's wrestling match while attending Topanga's 16th Birthday Party.
Boy Meets World,13,4,10,Turkey Day,1996-11-22,"After learning about prejudice among the tribes of Africa, Cory & Shawn want to have their families celebrate Thanksgiving together."
Boy Meets World,13,4,11,An Affair to Forget,1996-11-29,"When Shawn is dumped by Jennifer, Cory begins bad mouthing her. When Jennifer finds out about what Cory has been saying, she takes Shawn back on the condition that he end his relationship with Cory."
Boy Meets World,13,4,12,Easy Street,1996-12-13,Cory gets a job at a restaurant controlled by the Mafia; when Shawn tells him who owns the restaurant Cory quits. Shawn takes Cory's job to earn money for Christmas.
Boy Meets World,13,4,13,B & B's B'n B,1997-01-10,"With Mr. Feeny going out of town, Shawn has a brilliant idea to finish his economics project: a Bed & Breakfast at Feeny's House."
Boy Meets World,13,4,14,Wheels,1997-01-17,Cory can't wait to break in his new driver's license by going on a road trip with his friends. Cory's plans hit a speed bump when Alan has a tough time letting his son grow up.
Boy Meets World,13,4,15,Chick Like Me,1997-01-31,"In order to get a better understanding of how girls think, Cory and Topanga disguise Shawn as a girl and arrange a date for him."
Boy Meets World,13,4,16,A Long Walk to Pittsburgh (1),1997-02-07,"Eric sees Shawn kiss Topanga on the cheek at Chubbie's. He relates the upsetting news to Cory and Shawn swears the kiss was innocent. Cory is still angry but when he finds out that Topanga is moving to Pittsburgh, he realizes he had bigger problems than he thought."
Boy Meets World,13,4,17,A Long Walk to Pittsburgh (2),1997-02-14,"Cory is despondent without Topanga. One rainy evening, Topanga shows up on Cory's doorstep. She ran away from home and wants to convince her parents to let her live with an aunt in town. Cory and Topanga must convince Cory's parents and Topanga's aunt that they are truly in love."
Boy Meets World,13,4,18,Uncle Daddy,1997-02-28,"When Eric discovers his girlfriend Kelly has a son, he decides he is ready to have an adult relationship. However, he is not as prepared for adult responsibility as he thought. Meanwhile, Cory, Topanga, and Shawn study for the SATs."
Boy Meets World,13,4,19,Quiz Show,1997-03-21,"The educational game show High School Quiz is suddenly popular once again when Cory, Shawn, and Topanga get involved with the show. The questions are intentionally dumbed down to accommodate the three guests and Mr. Feeny is dismayed at the sacrificing of education for entertainment."
Boy Meets World,13,4,20,Security Guy,1997-04-04,"After getting fired from Alan's store, Eric gets a job as a security guard. Mr. Feeny becomes concerned that Eric is wasting his potential and encourages Eric to buckle down and re-take the SATs. Cory and Topanga try to convince Shawn to take an SAT prep course."
Boy Meets World,13,4,21,Cult Fiction,1997-04-25,Shawn joins a cult. Corey and the others try to snap him out of it. But it's not until Jonathan's in the hospital that Shawn sees clearly.
Boy Meets World,13,4,22,Learning to Fly,1997-05-02,"Eric passes up an interview at Pennbrook in favor of visiting Beach State. Cory and Topanga want to go with him but Topanga's aunt refuses to let her be alone with Cory for a weekend. Cory, Shawn, and Eric go to the college visit alone and Eric realizes he has a difficult decision to make about the future. When Cory discovers that Topanga had a different reason for not accompanying him on the visit, Cory has a tough decision to make as well."
Boy Meets World,13,5,1,Brothers,1997-10-03,Eric moves back home and Cory promises to find him a place to stay. Things take a strange turn when Eric's new roommate turns out to be Shawn's half brother Jack.
Boy Meets World,13,5,2,Boy Meets Real World,1997-10-10,"Cory turns the camera on Eric, Shawn, and Jack to make a film about them, but soon a fight between Shawn and Jack erupts and Topanga wants Cory to intervene."
Boy Meets World,13,5,3,It's Not You ... It's Me,1997-10-17,"Shawn has a hard time with the news that Cory applied to Stanford, a school Shawn could never get into. Shawn starts to suspect he and Cory are going to grow apart and decides to end their friendship sooner rather than later."
Boy Meets World,13,5,4,Fraternity Row,1997-10-24,Eric decides to start his own fraternity (Magnum P.I.); Shawn begins to slack off on school work because he doesn't expect to get into college.
Boy Meets World,13,5,5,The Witches of Pennbrook,1997-10-31,"Jack puts girls in front of friendship when he falls for a girl named Millie. Eric, on the other hand, soon discovers that the girl is a witch but Jack is in too deep to see the truth. This puts the two at odds. Meanwhile, Topanga overcomes her fear of flying when she and Cory travel to Pittsburgh."
Boy Meets World,13,5,6,"No Guts, No Cory",1997-11-07,Salem the Cat uses a time ball to transport Cory back to the 1940s. Cory is shipped off to fight in World War II and must leave Topanga behind.
Boy Meets World,13,5,7,"I Love You, Donna Karan (1)",1997-11-14,Shawn is forced to reconsider his own stubborn determination to keep relationships brief when he believes that he might have found a suitable match.
Boy Meets World,13,5,8,Chasing Angela (2),1997-11-14,"Cory tells Shawn about the lost purse mix-up and Shawn realizes he might be in love with Angela. However, Angela might not feel the same way. Across town, Jack and Eric are nervous about hosting Thanksgiving dinner for the Matthews family in their new apartment."
Boy Meets World,13,5,9,How to Succeed in Business,1997-11-28,Cory becomes jealous when Shawn outperforms him in a work-study job. Eric feels self-conscious when Amy enrolls in his creative writing class.
Boy Meets World,13,5,10,Last Tango in Philly,1997-12-05,The girls want to go dancing but Shawn and Cory aren't in the mood. The ladies go out on the town with two handsome co-workers. Shawn and Cory fight their jealousies and try to figure out how to make their girlfriends happy.
Boy Meets World,13,5,11,A Very Topanga Christmas,1997-12-19,"Topanga spends her first Christmas at the Matthews home. Cory is happy at first but when traditions clash, he starts to have misgivings about their future together."
Boy Meets World,13,5,12,Raging Cory,1998-01-09,Alan is forced to re-evaluate himself as a father when he notices that his relationship with both his sons is lacking.
Boy Meets World,13,5,13,The Eskimo,1998-01-16,Shawn tries to win tickets to the super bowl.
Boy Meets World,13,5,14,Heartbreak Cory,1998-02-06,"While on the senior class's ski trip, Cory sprains his ankle and meets another woman who takes care of him and chases him to stray from Topanga."
Boy Meets World,13,5,15,First Girlfriends' Club,1998-02-13,"On Valentine's Day, Shawn's ex-girlfriends are so certain he is going to ruin his relationship with Angela that they kidnap him in order to keep him for hurting her. Meanwhile, Cory must face the music when Topanga reads Lauren's letter."
Boy Meets World,13,5,16,Torn Between Two Lovers (Feeling Like a Fool),1998-02-27,"Lauren travels to Philadelphia to see Cory, and Topanga tells Cory to go out with her to test his feelings. Despite Shawn's warnings that it's a trap, Cory agrees to go out with Lauren. Eric proctors for Feeny's citizenship class."
Boy Meets World,13,5,17,And Then There Was Shawn,1998-02-27,"The gang finds themselves locked in the school, all alone, during detention."
Boy Meets World,13,5,18,If You Can't Be with the One You Love...,1998-03-06,"In an effort to numb his heartache, Cory steals a bottle of whiskey from Alan. He offers to share the bottle with Shawn and the two drown their sorrows. Trouble arises when Shawn discovers he likes the alcohol a little too much."
Boy Meets World,13,5,19,Eric Hollywood,1998-03-20,A Hollywood director spots Eric in a school play and asks him to be in his show. Shawn and Jack get the chickenpox and Topanga takes care of them.
Boy Meets World,13,5,20,Starry Night,1998-04-03,"When Topanga goes to an art exhibit with Angela, she meets a charming guy and threatens to break-up Cory and Topanga forever."
Boy Meets World,13,5,21,Honesty Night,1998-04-24,Cory and Topanga are back together but decide to keep it a secret from Shawn. They pretend to still be arguing to make Shawn think he is the one who reunited them.
Boy Meets World,13,5,22,"Prom-ises, Prom-ises",1998-05-01,"On prom night Cory and Shawn decide they are ready to become men and while Angela is not ready, Topanga agrees to getting a hotel room."
Boy Meets World,13,5,23,Things Change,1998-05-08,Cory has problems accepting all the changes that are happening around him.
Boy Meets World,13,5,24,Graduation,1998-05-15,The group is getting ready to graduate and Mr. Feeny assigns them one last assignment about what they are feeling the last few weeks of school before graduation.
Boy Meets World,13,6,1,His Answer (1),1998-09-25,"When Topanga proposes for him to marry her at graduation, Cory is absolutely stunned. However, when everyone else has conflicting views on the subject, Cory and Topanga quietly slip away to elope."
Boy Meets World,13,6,2,Her Answer (2),1998-10-02,"When Topanga finds that she can't say 'I do' at the altar, things get worse as Amy gets angry and Eric tries to stop Mr. Feeny's retirement party."
Boy Meets World,13,6,3,Ain't College Great?,1998-10-09,"Eager Cory visits his guidance counselor to prepare his college schedule and ethsuastically picks the hardest classes, but he soon realizes it's too hard."
Boy Meets World,13,6,4,Friendly Persuasion,1998-10-16,"Although Angela's upset after she and Shawn call it quits, she shuns Cory's offer of support, claiming they were never friends."
Boy Meets World,13,6,5,Better Than the Average Cory,1998-10-23,"After Cory is introduced to art prodigy Alexandra Nechita, he develops an inferiority complex and blames his lack of skills on his 'average' father. Meanwhile, Alexandra, lonely touring without anyone her own age, befriends Morgan."
Boy Meets World,13,6,6,Hogs and Kisses,1998-10-30,"After a director has Shawn and Topanga kiss while making a promotional film, Cory-certain the duo are harboring romantic feelings for one another-directs them to go on a date and explore their emotions. Meanwhile, Eric and Jack pretend to be mannerly in front of Rachel."
Boy Meets World,13,6,7,Everybody Loves Stuart,1998-11-06,"Cory may be possibly expelled from college, when he knocks a teacher out the screen-window of the commons room. However, that same teacher hit on Topanga in her dorm last night, and he's lying about it."
Boy Meets World,13,6,8,You're Married You're Dead,1998-11-13,"Cory loses his engagement ring when he goes to a bikini club with scantily-clad waitresses to prove that he still fits in with the rest of the guys, despite being engaged."
Boy Meets World,13,6,9,Poetic License: An Ode to Holden Caulfield,1998-11-20,"When Cory degrades a student's poem that Mr. Feeny reads in class, he is dismayed when he finds out that Shawn wrote it."
Boy Meets World,13,6,10,And in Case I Don't See Ya,1998-12-04,"In an effort to become more popular, Eric creates a TV show similar to The Truman Show featuring his roommates, but it's Rachel who becomes the campus darling. Meanwhile, Cory and Shawn expect special treatment from Mr. Feeny."
Boy Meets World,13,6,11,Santa's Little Helpers,1998-12-11,"Cory and Topanga figure out that Shawn and Angela still love each other, but they have contradictory opinions on what to do about it."
Boy Meets World,13,6,12,Cutting the Cord,1999-01-08,Shawn and Angela decide to separate and proceed to ask Cory and Topanga to refrain from interfering in their romantic lives anymore.
Boy Meets World,13,6,13,We'll Have a Good Time Then,1999-01-22,"Shawn and Jack's dead beat father, Chet, reappears on campus and promises Shawn that he has come to stay and make amends to his sons for never being there."
Boy Meets World,13,6,14,Getting Hitched,1999-01-29,"Cory and Topanga play 'The Fiancée Game' to prove how compatible they are, and are crushed when Eric and Rachel prove to know far more about each other than they do. Topanga suggests a quick solution: they should live together on campus and really get to know each other. "
Boy Meets World,13,6,15,Road Trip,1999-02-05,"To get his mind off of his dad's death, Shawn brings Cory along on a soul-searching road trip in Chet's trailer, where they end up at a truck shop."
Boy Meets World,13,6,16,My Baby Valentine,1999-02-12,"Cory becomes upset when Topanga seems less interested in spending Valentine's Day with him than with consoling Amy about the last stages of her pregnancy, so when Topanga decides to cheer Amy up with a baby shower, Cory takes charge."
Boy Meets World,13,6,17,Resurrection,1999-02-19,"While everyone restlessly awaits newly born Joshua Matthews, Cory's continued vanity alienates Topanga, who considers herself a member of the Matthews family."
Boy Meets World,13,6,18,Can I Help to Cheer You?,1999-03-12,Topanga gets carried away with wedding plans and yearning a classy ceremony with her friends and family in the hall of her dreams.
Boy Meets World,13,6,19,Bee True,1999-04-09,"Cory and Shawn join for the last time as a 'bad boy' team to help Mr. Feeny, whose uncertainty in declaring his feelings for Dean Bolander looks like a mistake."
Boy Meets World,13,6,20,The Truth About Honesty,1999-04-30,Cory and Topanga cause tension at Rachel and Jack's first dinner party by making an agreement to tell the truth about everything and everyone.
Boy Meets World,13,6,21,The Psychotic Episode,1999-05-07,A concerned Cory seeks out Mr. Feeny's rational interpretation when he experiences a series of nightmares involving the murder of Shawn.
Boy Meets World,13,6,22,State of the Unions,1999-05-14,"While Cory stresses about his future marriage, Topanga's parents reveal some unanticipated news that they are on the verge of separating."
Boy Meets World,13,7,1,Show Me the Love,1999-09-24,Shawn and Cory travel to Pittsburgh to persuade Topanga's parents to get back together after Topanga calls off her and Cory's wedding.
Boy Meets World,13,7,2,For Love and Apartments,1999-10-01,"After Cory and Topanga and Shawn and Angela break up, the girls choose to challenge the boys to a wresting match to decide who gets to keep the apartment."
Boy Meets World,13,7,3,Angela's Men,1999-10-08,"Angela's father comes to visit her, helping her reconcile with Shawn. Eric plans his revenge on Topanga."
Boy Meets World,13,7,4,No Such Thing as a Sure Thing,1999-10-15,"Topanga decides to put her money on Cory, While Eric gets Jack in over his head with a bookie."
Boy Meets World,13,7,5,You Light Up My Union,1999-10-22,Rachael gets mad when Cory and Shawn read her diary. While Jack and Eric take over as managers of the student union.
Boy Meets World,13,7,6,They're Killing Us,1999-10-29,Cory and Topanga dish out the ups and downs of planning their wedding. Including his selection for best man and her dress-hating bridesmaids.
Boy Meets World,13,7,7,It's About Time,1999-11-05,Corey and Topanga finally tie the knot but not without dealing with Shawn's concerns for his future friendship with Corey and Eric arranging for his brother to have a nicer wedding at an upscale hotel.
Boy Meets World,13,7,8,The Honeymooners,1999-11-12,"Cory and Topanga are oblivious to the fact that Eric has followed them to their tropic honeymoon, where they consider relocating to, permanently."
Boy Meets World,13,7,9,The Honeymoon is Over,1999-11-19,Cory and Topanga realize they are on their own when Shawn moves into the girls' apartment and Cory's parents refuse to take them in.
Boy Meets World,13,7,10,Picket Fences,1999-11-21,Cory and Topanga decide that a house is not right for them when Shawn convinces them to fix up their apartment.Meanwhile Jack and Eric get a new boss at the student union.
Boy Meets World,13,7,11,What a Drag!,1999-12-03,Cory redecorates the apartment. Meanwhile Eric and Jack pose as girls to hide from a goon on campus.
Boy Meets World,13,7,12,Family Trees,1999-12-17,"Shawn has trouble dealing with the fact he doesn't know who his parents are.Meanwhile Eric throws a surprise party for Alan but, Shawn gets a even bigger surprise when the Matthews offer to adopt him."
Boy Meets World,13,7,13,The Provider,2000-01-07,Cory gets upset because he thinks Topanga is better than him. Meanwhile Eric finds a lucky Penny.
Boy Meets World,13,7,14,"I'm Gonna Be Like You, Dad",2000-01-28,"Cory overreacts to a low score on a health test that says he should be dead already. Meanwhile, Eric joins the family business but Amy and Mr. Feeny don't think it's a good idea."
Boy Meets World,13,7,15,The War (1),2000-02-11,A prank war among the seven friends gets out of hand.
Boy Meets World,13,7,16,Seven the Hard Way (2),2000-02-11,After the prank war got out of hand the gang comes close to breaking up even Mr.Feeny's intervention could not help.We even get a glimpse into the future how everyones life turned out if they lost all contact with each other.
Boy Meets World,13,7,17,She's Having My Baby Back Ribs,2000-03-03,Eric and Topanga go on a diet because they have noticed they have gained weight and Cory thinks that Topanga is Pregnant.
Boy Meets World,13,7,18,How Cory and Topanga Got Their Groove Back,2000-03-17,Cory and Topanga grey to shed their boring personas by hosting a bash on the same night as the school's biggest party of the year.
Boy Meets World,13,7,19,Brotherly Shove,2000-03-31,"The Matthews family puts together a garage sale, leading Eric and Cory to battle over which of their items are no longer needed or wanted."
Boy Meets World,13,7,20,As Time Goes By,2000-04-07,When Topanga is stressed out she is transported to a 1940s black-and-white setting where she doesn't remember anything about her past and it teaches her no to so uptight.
Boy Meets World,13,7,21,Angela's Ashes,2000-04-28,"When Angela's father wants to take her to Europe for a year, Shawn has to make a decision whether to let her go or ask her to stay. Meanwhile, Jack, Eric and Rachel think about their future."
Boy Meets World,13,7,22,Brave New World (1),2000-05-05,Topanga gets a job in New York and Cory fears having to leave Philadelphia.
Boy Meets World,13,7,23,Brave New World (2),2000-05-05,As all the friends say goodbye to each other they all make one last stop to Mr. Feeny's Classroom for their last goodbye to Mr.Feeny where he gives them his very last piece of advice.
Hangin' with Mr. Cooper,14,1,1,The Presentation,1992-09-22,"Mark is hired as a substitute teacher, but his roommate Robin must teach him how to control his students. Alan Thicke guest stars."
Hangin' with Mr. Cooper,14,1,2,Hangin' with Michelle,1992-09-29,"Mark injures himself while performing a story for his substitute first-grade class, including Michelle Tanner. Afterward, Mark is too embarrassed to keep his date with a beautiful woman."
Hangin' with Mr. Cooper,14,1,3,On the Rebound,1992-10-06,"Mark's ex-girlfriend, Paula, moves back into town and revives their passionate romance."
Hangin' with Mr. Cooper,14,1,4,Please Pass the Jock,1992-10-20,Mark helps a student basketball player pass an important algebra test. Chris Tucker guest stars.
Hangin' with Mr. Cooper,14,1,5,Cheers,1992-10-27,"When Mark coaches a girl's cheerleading team, he desperately asks Vanessa to help him train the untalented cheerleaders."
Hangin' with Mr. Cooper,14,1,6,Warriors (1),1992-11-10,"After Mark finally gets a permanent teaching job as a basketball coach, he's offered a contract to play for the Warriors, a professional basketball team."
Hangin' with Mr. Cooper,14,1,7,Warriors (2),1992-11-17,"Mark is given a temporary contract to play professional basketball with his favorite team, the Warriors. Unfortunately, Mark must play guard against basketball star Charles Barkley."
Hangin' with Mr. Cooper,14,1,8,Torn Between Two Teachers,1992-11-24,Mark and Robin try to make Andre choose between his interests in basketball and music.
Hangin' with Mr. Cooper,14,1,9,My Dinner with Mark,1992-12-01,"When Vanessa's boss is stranded at an airport, she convinces Mark to impersonate him for an important meeting with an influential businesswoman."
Hangin' with Mr. Cooper,14,1,10,Miracle in Oaktown,1992-12-15,"While portraying Santa Claus, Mark helps to make a little boy's Christmas wish come true."
Hangin' with Mr. Cooper,14,1,11,Unforgettable,1993-01-05,"Mark helps settle a family fight between Robin and her father, Chip."
Hangin' with Mr. Cooper,14,1,12,In Vanessa We Trust,1993-01-12,"After their landlord dies, Mark, Vanessa and Robin try to buy their house for themselves."
Hangin' with Mr. Cooper,14,1,13,Forbidden Fruit,1993-01-19,"Mark eagerly dates Teresa, an attractive schoolteacher, until he learns that her father is Coach Ricketts."
Hangin' with Mr. Cooper,14,1,14,How to Succeed in Business Without Really Trying,1993-02-02,"When Mark takes a temporary job in an office mail room, he is quickly promoted to an executive position."
Hangin' with Mr. Cooper,14,1,15,Valentine's Day Massacre,1993-02-09,Robin and Vanessa win dates with handsome bachelors on a television game show while Mark spends Valentine's Day at home.
Hangin' with Mr. Cooper,14,1,16,Boyz in the Woodz,1993-02-16,"Mark, Vanessa and Robin take several high school students on a camping trip."
Hangin' with Mr. Cooper,14,1,17,Boys Don't Leave,1993-02-23,"Tyler is jealous of his parents' new baby and asks to move in with Mark, Vanessa and Robin."
Hangin' with Mr. Cooper,14,1,18,The Unteachables,1993-03-02,"When Mark teaches a history class for lazy students, Coach Ricketts wagers that he can't get them to study."
Hangin' with Mr. Cooper,14,1,19,Piano Lesson,1993-03-16,Robin begins to feel neglected as Mark and Vanessa develop a close friendship.
Hangin' with Mr. Cooper,14,1,20,P.M.S.: Post Moving-in Syndrome,1993-04-13,Mark and his roommates Robin and Vanessa learn how to share the responsibilities of living together. Shawn Wayans guest stars.
Hangin' with Mr. Cooper,14,1,21,A Moving Experience,1993-05-11,Mark accepts Trey's offer to be his roommate in an apartment building filled with beautiful women and wild parties.
Hangin' with Mr. Cooper,14,1,22,Livin' a Large Lie,1993-05-18,"When Mark's grandmother visits him, he wants to impress her with his success and asks Robin and Vanessa to pose as his servants."
Hangin' with Mr. Cooper,14,2,1,Baby Love,1993-09-24,"Mark's cousin, Geneva, and her daughter, Nicole, move into Mark and Vanessa's house."
Hangin' with Mr. Cooper,14,2,2,Slumber Party,1993-10-01,"When Vanessa and Geneva get stranded in the middle of a forest due to a broken down car, Mark is forced to chaperone Nicole's slumber party by himself."
Hangin' with Mr. Cooper,14,2,3,School's a Drag,1993-10-08,"Mark gets in an accident with the school's drivers' education car and fears the tough, new principal, P.J. Moore, may discharge him."
Hangin' with Mr. Cooper,14,2,4,Limpin' Lizards,1993-10-15,"Nicole gets the part as the new crocodile kid on the show. When Mark complains about being assigned as the Driver's Education teacher, PJ reassigns him to the Home Economics teacher position."
Hangin' with Mr. Cooper,14,2,5,Free at Last,1993-10-22,"When Vanessa is not given the promotion she was promised, she takes Mark's advice to demand her rights and is promptly discharged from her job."
Hangin' with Mr. Cooper,14,2,6,Father Fairest,1993-10-29,"When Earvin tells Mark that his greatest wish is to see his long-lost father, Mark locates Earvin's dad and invites him to the Halloween dance with nearly disastrous results."
Hangin' with Mr. Cooper,14,2,7,The Goodbye Girl,1993-11-05,"Mark persuades Geneva to use on the rebellious Nicole, and they let her do anything she wants to teach her that rules are important. Vanessa pretends to like sports to impress a man."
Hangin' with Mr. Cooper,14,2,8,Seoul Shake,1993-11-12,Mark learns that Earvin is prejudiced against Koreans when Mark puts a Korean boy on the basketball team.
Hangin' with Mr. Cooper,14,2,9,The Prince of Soul,1993-11-19,"When a man claiming to be an African prince proposes to Vanessa, Mark convinces her that the man is a clever thief trying to cheat them out of their home."
Hangin' with Mr. Cooper,14,2,10,Air Cooper,1993-11-26,"When an advertising executive selects Mark to star in a commercial for athletic shoes, Mark misunderstands the part he is to play."
Hangin' with Mr. Cooper,14,2,11,Santa's Got a Brand New Bag,1993-12-10,"Mark and Geneva are saddened when Nicole stops believing in Santa. Then a mysterious cousin visits, who knows how to make Nicole happy."
Hangin' with Mr. Cooper,14,2,12,Private School,1993-12-17,"Mark is assigned to teach Black history at an expensive private school for one week. When the principal offers him a job at a much higher salary, Mark has a big decision to make."
Hangin' with Mr. Cooper,14,2,13,For Whom the Heck the Bell Tolls,1994-01-07,"Not wanting to admit that he can't remember a recently deceased basketball coach, Mark agrees to give the eulogy at his funeral."
Hangin' with Mr. Cooper,14,2,14,It's My Party and I'll Die If I Want To,1994-01-21,"It is Mark's 30th birthday, Tyler discovers a lump on Mark. After a misunderstanding between he and his doctor, Mark thinks that he is dying so he goes skydiving and gives away his stuff."
Hangin' with Mr. Cooper,14,2,15,The Courtship of Mark Cooper,1994-01-28,Mark is in the midst of defending himself in court when he realizes the plaintiff's lawyer is an ex-girlfriend he dumped brutally.
