show_name,show_id,season,episode_num,episode_name,original_air_date,synopsis
Family Matters,2,3,15,Jailhouse Blues,1992-01-17,Eddie and Steve land in jail when Eddie's smooth-talking cousin Clarence steals a Ferrari.
Family Matters,2,3,16,Brown Bombshell,1992-01-31,"Carl struggles to deal with Steve's pen pal, a woman who has just been released from prison. She is in love with Steve, but Steve had sent her a photo of Carl. Mother Winslow tries to relate family history to her uninterested family."
Family Matters,2,3,17,"Food, Lies and Videotape",1992-02-07,Steve takes a cooking class.
Family Matters,2,3,18,My Broken-Hearted Valentine,1992-02-14,"Steve asks Laura to be his valentine, but she declines, favoring instead the offer of Daniel Wallace. Maxine warns Laura that Daniel will try to seduce her, but Laura doesn't believe her until it's too late."
Family Matters,2,3,19,Woman of the People,1992-02-21,"When Laura runs against a friend for student council president, the girl tries to blackmail Laura by threatening to publish a photo of Steve and Laura in an apparent embrace!"
Family Matters,2,3,20,Love and Kisses,1992-02-28,"Desperate for Laura's attention, Steve promises to introduce her to soul singer Johnny Gill in exchange for a kiss. After 20 years of marriage, Carl and Harriette finally have a honeymoon, but with some unexpected problems."
Family Matters,2,3,21,"Stop, in the Name of Love",1992-03-13,"Harriette and Carl agree that Mother Winslow's vision is too bad for her to keep driving, but neither wants to tell her. Laura tries to help Waldo gain some confidence, but Waldo thinks she's in love with him."
Family Matters,2,3,22,The Urkel Who Came to Dinner,1992-04-03,"When his parents go on a vacation without him, Harriette invites Steve to stay with the Winslows."
Family Matters,2,3,23,Robo-Nerd (2),1992-04-24,"Steve's robot look-alike, Urkelbot, returns to fight crime. The Winslow women try a new line of hair products and go bald."
Family Matters,2,3,24,Dudes,1992-05-01,"Eddie, Waldo and Steve are contestants on a television dating show where Steve professes his eternal love for Laura, embarrassing her. Carl lies, claiming he does not want a birthday party this year."
Family Matters,2,3,25,"Farewell, My Laura",1992-05-08,"Rachel and Laura read a story that Steve wrote. In the story, Steve is a 1940s detective whom Laura hires to protect Rachel, but when Rachel is killed, Steve must investigate all the suspects and deduce her murderer's identity."
Family Matters,2,4,1,Surely You Joust,1992-09-18,"When Carl becomes angry with his obnoxious neighbor Steve, they arrange to fight it out--on national television."
Family Matters,2,4,2,Hot Wheels,1992-09-25,Carl buys Eddie a used police car so they can refurbish it together. Steve glues himself to Laura just as she is supposed to go out on a much anticipated date.
Family Matters,2,4,3,Dance to the Music,1992-10-02,Laura is impressed when Steve arranges a great date for her--with another guy. Carl is jealous when Harriette takes piano lessons from a handsome young man.
Family Matters,2,4,4,Driving Carl Crazy,1992-10-09,"When Laura says she will go steady with the next boy to ask her out who has his own car, Steve acquires a car and persuades Carl to teach him to drive."
Family Matters,2,4,5,Rumor Has It,1992-10-16,"Ted spreads the rumor that he had sex with Laura, and Steve decides to reveal the rumor as false--at any cost."
Family Matters,2,4,6,Number One with a Bullet,1992-10-23,"Steve is hospitalized for an appendectomy, and Carl is happy to be rid of him. But when Carl is shot, he must share a hospital room with Steve."
Family Matters,2,4,7,Whose Kid Is It Anyway?,1992-10-30,"Eddie promises to take Richie trick-or-treating, but he leaves Richie with Waldo, who loses the boy."
Family Matters,2,4,8,An Officer and a Waldo,1992-11-06,"Eddie insults Waldo, who then joins the army. Eddie and Steve go to rescue him and are mistaken for army recruits--possibly the worst recruits ever."
Family Matters,2,4,9,Just One Date,1992-11-13,"When Laura refuses, for the thousandth time, to go out on a date with Steve, he climbs onto the Winslows' roof and vows to stay up there until Laura agrees to go out with him."
Family Matters,2,4,10,The Oddest Couple,1992-11-20,"After Eddie gets in a huge fight with Carl, he moves out and shares an apartment with Steve."
Family Matters,2,4,11,"It's a Mad, Mad, Madhouse",1992-11-27,"The Winslow household suffers when Harriette refuses to cook and clean. When Eddie's teacher arrives to see Eddie's home life, she gets a horrible impression."
Family Matters,2,4,12,It's Beginning to Look a Lot Like Urkel,1992-12-11,"Laura's guardian angel arrives and shows her a world where Steve's and Laura's roles are reversed--Steve is sauve, while Laura is socially inept."
Family Matters,2,4,13,Muskrat Love,1993-01-08,"The 'Sadie Hawkins Day' dance becomes interesting when Eddie refuses Melissa's offer to take him and then regrets it, while Laura's best friend goes with the guy Laura wanted to ask."
Family Matters,2,4,14,The Way the Ball Bounces,1993-01-22,"Both Eddie and Laura want to go to college.Laura works day and night studying for a big entrance exam, and Eddie decides to go to an easy college that wants him to play basketball for them."
Family Matters,2,4,15,A Thought in the Dark,1993-01-29,Laura and Ted arrange a blind date for Steve with Ted's cousin Myra.
Family Matters,2,4,16,Tender Kisses,1993-02-05,"When Eddie can't get tickets to the big Tracie Spencer (HERSELF) concert, he sneaks into Tracie's hotel room to meet her."
Family Matters,2,4,17,Heart Strings,1993-02-12,Valentine's Day brings romance into the Winslows' home as Laura agrees to be Steve's valentine and Gwendolyn tries to convince Richie to be her valentine.
Family Matters,2,4,18,Higher Anxiety,1993-02-19,Carl becomes distressed when Mother Winslow goes camping with her boyfriend. Eddie's near-death exprience helps him realize that breaking up with his girlfriend isn't so bad.
Family Matters,2,4,19,Mama's Wedding,1993-02-26,"Carl gives Mother Winslow and Fletcher a huge wedding, which gets even bigger when more than one hundred of Eddie's friends arrive by mistake."
Family Matters,2,4,20,Pulling Teeth,1993-03-19,"When Laura's best friend, Maxine, ends her relationship with her boyfriend, Laura, Steve, Eddie and Waldo all help get Maxine and Waldo together for a date."
Family Matters,2,4,21,Walk on the Wild Side,1993-03-26,"When Laura sneaks into a male strip club, Steve learns that Harriette is going as well, and he tries to warn Laura."
Family Matters,2,4,22,Hot Stuff,1993-04-30,Laura successfully gets Steve romantically interested in Myra. Eddie buys a new car stereo system and realizes he got a good price because the equipment is stolen.
Family Matters,2,4,23,Stormy Weather,1993-05-07,"Laura attends the Junior Prom with Jimmy, who forbids her to speak to Steve. When Steve arrives at the prom with a gorgeous girl, Myra, all the students are shocked!"
Family Matters,2,4,24,Buds 'n' Buns,1993-05-14,"Carl takes an extra job at a hot dog restaurant, working with his son, Eddie, but Eddie gets promoted and becomes his dad's boss. When Steve stops annoying Laura, she misses his friendship."
Family Matters,2,5,1,Hell Toupee,1993-09-24,"Carl buys a toupee after enduring one too many jokes from Harriette. Steve tries to end the interminable bickering between Laura and his new girlfriend, Myra."
Family Matters,2,5,2,It Didn't Happen One Night,1993-10-01,"Steve offers to drive Laura to a cheerleading championship after she misses the bus, but Steve's car breaks down and Laura and Steve must share a motel room for the night."
Family Matters,2,5,3,Saved by the Urkel,1993-10-08,"After Steve saves Carl's life, Carl and and his family feel obligated to be nice to him."
Family Matters,2,5,4,A Matter of Principle,1993-10-15,"When Harriette's boss asks her to fire part of her staff, Carl encourages her to refuse, but Harriette's boss fires her instead. Myra transfers to Steve's school to be closer to him"
Family Matters,2,5,5,Money Out the Window,1993-10-22,"Eddie bets on football games, then steals a stamp from his father's collection to pay his bookie. Laura works two jobs to buy a car."
Family Matters,2,5,6,Best Friends,1993-10-29,Eddie hires his good friend Waldo to work at Mighty Weenie and then considers discharging Waldo because he's horrible at the job. Laura is embarrassed by her mother.
Family Matters,2,5,7,Grandmama,1993-11-05,"Eddie agrees to be Steve's partner in a basketball tournament but then finds a better partner. Steve partners with an old lady, Grandmama."
Family Matters,2,5,8,Dr. Urkel and Mr. Cool,1993-11-12,"When Laura tells Steve to be less annoying, he creates a potion that transforms him into a suave, charming man. But his new attitude soon causes more problems than it solves."
Family Matters,2,5,9,Car Wars,1993-11-19,"Laura encounters sexism while shopping for a used car, but she uses the salesman's sexist attitudes against him to negotiate a good price for a car."
Family Matters,2,5,10,All the Wrong Moves,1993-11-26,"To teach Carl a lesson, Harriette makes him pay her for her housework. Steve and Laura both have overly aggressive dates at the same drive-in movie."
Family Matters,2,5,11,Christmas Is Where the Heart Is,1993-12-10,Carl learns the true meaning of Christmas aboard a train stranded in a snowstorm as Steve attempts to cheer the miserable passengers.
Family Matters,2,5,12,Scenes from a Mall,1993-12-17,The shopping mall is the meeting place for a battle between the sexes as the Winslow children and their friends converge.
Family Matters,2,5,13,Rock Enroll,1994-01-07,"After performing with his friend, the famous singer SHANICE, at a benefit concert, Eddie announces his plans to pursue a singing career rather than go to college."
Family Matters,2,5,14,Like a Virgin,1994-01-14,Eddie is humiliated when his friends learn that he is still a virgin.
Family Matters,2,5,15,"Good Cop, Bad Cop",1994-01-21,Eddie is harassed by police officers while driving through a white neighborhood.
Family Matters,2,5,16,Presumed Urkel,1994-02-04,Laura defends classmate Steve in a student trial when he is accused of blowing up the science laboratory.
Family Matters,2,5,17,Father of the Bride,1994-02-11,"Carl dreams that his daughter, Laura, marries Steve."
Family Matters,2,5,18,Psycho Twins,1994-02-18,"When Carl, Steve and the boys visit a professional wrestler, Steve's potion puts the wrestler and his partner to sleep--and Carl and Steve agree to take the wrestlers' places in the ring"
Family Matters,2,5,19,That's What Friends Are For,1994-03-04,"When Waldo is worried that college will end his friendship with Eddie and Carl is afraid to take the test to become a lieutenant, Eddie and Mother Winslow help them gain self-confidence."
Family Matters,2,5,20,Opposites Attract,1994-03-18,Laura clashes with an overeager reporter at the school newspaper--but then realizes her attraction to him. Steve suffers from a severe attack of the hiccups after he's robbed in his home.
Family Matters,2,5,21,A-Camping We Will Go,1994-04-01,"Carl, Eddie and Waldo's camping trip is disrupted when Steve arrives. Steve becomes even more annoying when he warns them about dangers at their campsite--all of which prove to be true."
Family Matters,2,5,22,Nunsense,1994-04-29,"Steve, Eddie and Waldo dress up as nuns and search for Myra in the convent to which she went after Steve ended their relationship."
Family Matters,2,5,23,Aunt Oona,1994-05-06,"Steve's dowdy Aunt Oona visits and, with Harriette's help, becomes confident enough to win a singing competition."
Family Matters,2,5,24,Stefan Returns,1994-05-20,"Laura encourages nerdy Steve to create a new, improved potion to transform himself into his suave alter ego again--this time without the obnoxious side effects."
Family Matters,2,6,1,To Be or Not to Be (1),1994-09-23,"Steve transforms back into Stefan to please Laura. When Carl has problems with his eyesight, Eddie convinces him to use Steve's transformation machine but something goes wrong."
Family Matters,2,6,2,To Be or Not to Be (2),1994-09-30,"Carl upsets his family when he must remain a nerd while the suave Stefan, formerly Steve Urkel, struggles to fix his transformation chamber."
Family Matters,2,6,3,Till Death Do Us Apartment,1994-10-07,"Eddie goes to college and moves into an apartment with Waldo but, despite his newfound freedom, has trouble with the opposite sex."
Family Matters,2,6,4,The Looney Bin,1994-10-14,"Steve and Carl get locked in the school bomb shelter with the school custodian, Mr. Looney. Harriette becomes discouraged in her search for a job."
Family Matters,2,6,5,Beta Chi Guy,1994-10-21,Eddie wants to join a college fraternity but his prospective fraternity brothers ask him to give up his friendship with the socially inept Steve.
Family Matters,2,6,6,Dark and Stormy Night,1994-10-28,"In a ghost story that the Winslow family invents during a power outage on Halloween, Carl and Harriette play vampires living in a castle."
Family Matters,2,6,7,Par for the Course,1994-11-04,"When he learns that his boss loves to play golf, Carl pretends to be interested in it as well. But the Captain cheats, and Steve insists Carl confront him and demand that he play fairly."
Family Matters,2,6,8,Sink or Swim,1994-11-11,"Carl must teach Steve to swim, or Steve won't be able to graduate from high school. Rachel gets into a fight with Harriette when she tries to return a dress to the store where Harriette works in customer service."
Family Matters,2,6,9,Paradise Bluff,1994-11-18,"Steve and Myra are almost killed on lovers' lane, but Steve asks Myra to wear his science club pin. Carl is convinced that Harriette thinks he's an inadequate lover."
Family Matters,2,6,10,Flying Blind,1994-11-25,"When the pilot, a vindictive ex-convict, parachutes out of their plane, Carl and Steve are forced to fly an airplane together--and neither one knows how."
Family Matters,2,6,11,Miracle on Elm Street,1994-12-16,"In this Christmas episode, Richie invites a homeless man who claims to be Santa Claus to dinner. Steve searches through tons of garbage to find a special present for Laura."
Family Matters,2,6,12,Midterm Crisis,1995-01-06,Eddie and Steve try to bake a cake for Waldo's class project after eating the one Waldo made. Carl realizes that his boss is dating a stripper--and it's Carl's responsibility to tell him.
Family Matters,2,6,13,An Unlikely Match,1995-01-20,"When the school bully is diagnosed with leukemia, Steve organizes a bone marrow drive."
Family Matters,2,6,14,The Substitute Son,1995-02-03,"Eddie neglects Carl, so Waldo tries to be a 'son' to Carl. Steve transforms himself into a martial arts expert to defend Laura's honor."
Family Matters,2,6,15,The Gun,1995-02-10,"After she is robbed, Laura considers getting a gun, but the Winslows organize a gun turn-in program instead."
Family Matters,2,6,16,Wedding Bell Blues,1995-02-17,Steve's friend Mr. Looney is jilted on his wedding day when his fiance leaves him for the church organist.
Family Matters,2,6,17,Ain't Nothin' But an Urkel,1995-02-24,"Steve accidentally transforms himself into Elvis Presley. While they are counseling a young couple about marriage, Carl and Harriette get into an argument."
Family Matters,2,6,18,My Uncle Hero,1995-03-03,"Carl hosts Richie's class trip to the precinct. Myra sees Steve and Laura together and becomes jealous, not knowing they are planning a surprise party for her."
Family Matters,2,6,19,My Bodyguard,1995-03-17,"Carl loses his self-confidence after he is tricked by a robber, while Steve stops the thief. But then Carl is assigned to protect Steve from the robber's brother."
Family Matters,2,6,20,"Cheers Looking at You, Kid",1995-03-24,"Laura enjoys her independence when her parents allow her to fly to a cheerleading competition alone--but she must also decide what to do when a guy she likes visits her in her hotel room."
Family Matters,2,6,21,What's Up Doc?,1995-03-31,The Winslow family visits a psychiatrist for advice on how to live with Steve.
Family Matters,2,6,22,We're Going to Disney World (1),1995-04-28,"On a trip to Disney World, Steve transforms himself into his suave alter ego and proposes marriage to Laura, and Carl decides to quit his job and move the family to Florida."
Family Matters,2,6,23,We're Going to Disney World (2),1995-05-05,"On a trip to Disney World, Laura must decide whether to marry Steve's suave alter ego, Stefan, and Carl yearns for his job in Chicago."
Family Matters,2,6,24,"They Shoot Urkels, Don't They?",1995-05-12,A dance marathon pits Steve against Carl.
Family Matters,2,6,25,Home Sweet Home,1995-05-19,"Steve's parents move to Russia and Steve moves in with Eddie and Waldo. But when he causes their ceiling to collapse, Steve becomes Carl's houseguest instead."
Family Matters,2,7,1,Little Big Guy,1995-09-22,"Steve tries to show Carl a new moneymaking use of his transformation machine but it malfunctions and shrinks them both to a few inches in height, stranding them on the kitchen counter."
Family Matters,2,7,2,The Naked and the Nerdy,1995-09-29,Steve and Laura accidentally see each other naked--a traumatic experience for both. Carl's neighbor asks Carl to hold onto an expensive diamond bracelet.
Family Matters,2,7,3,Bugged,1995-10-13,Steve guiltily fantasizes about a gorgeous bug collector. Carl plays poker with Harriette's obnoxious boss.
Family Matters,2,7,4,Teacher's Pet,1995-10-20,"Steve substitute teaches his English class, but when things get out of control, Stefan saves the day."
Family Matters,2,7,5,Walking My Baby Back Home,1995-10-27,"When Eddie is forbidden to see his new girlfriend, he gets Steve to help arrange secret meetings for them. Mother Winslow is audited by the IRS."
Family Matters,2,7,6,She's Back,1995-11-03,"While Steve is visiting relatives in Russia, his cousin Myrtle visits the Winslows."
Family Matters,2,7,7,Hot Rods to Heck,1995-11-10,"To distract Laura from a flirtatious senior, Steve challenges him to a car race."
Family Matters,2,7,8,Talk's Cheap,1995-11-17,"Waldo convinces Steve, Myra and Laura to appear on a talk show to discuss unfulfilling romances. But everyone is surprised when Myrtle comes on and talks about her unrequited love for Eddie."
Family Matters,2,7,9,Struck by Lightning,1995-11-24,Steve refuses to go outside after being struck by lightening three times. Laura and Myra compete for the same sales job at a department store.
Family Matters,2,7,10,Best Years of Our Lives,1995-12-08,"Steve is put in charge of building the school's homecoming parade float. With some difficulty, he gets volunteers to build a beautiful float."
Family Matters,2,7,11,Fa La La La Laagghh!,1995-12-15,"Carl agrees to let Steve decorate the Winslow household for Christmas, and Harriette feels sad because Laura and Eddie seem to be too busy to participate in family Christmas activities."
Family Matters,2,7,12,Friendship Cycles,1996-01-05,"Steve really wants to go on a class bicycle trip with Myra, but he doesn't know how to ride a bicycle. When Carl refuses to teach Steve how to ride a bicycle, Steve tries to teach himself."
Family Matters,2,7,13,South of the Border,1996-01-12,"Urkel and Eddie are forced to travel to a small island country near Mexico, where Waldo has landed in jail for violating the country's little-known customs."
Family Matters,2,7,14,Life in the Fast Lane,1996-01-26,Steve becomes extremely nervous and destroys Carl's garage after mistaking Laura's diet pills for vitamins and ingesting them.
Family Matters,2,7,15,Random Acts of Science,1996-02-02,Steve and Carl are defenseless when they get robbed--until they step into Steve's transformation machine and become karate experts. Laura gets a nose ring.
Family Matters,2,7,16,Tips for a Better Life,1996-02-09,Carl gets upset when Eddie starts drinking excessively. Steve transforms into Stefan and plays at a jazz club.
Family Matters,2,7,17,Swine Lake,1996-02-16,"Eddie reluctantly enrolls in ballet lessons to improve his basketball skills. When he and his girlfriend, Greta, perform a ballet with the class, Myrtle Urkel arrives and takes Greta's place."
Family Matters,2,7,18,My Big Brother,1996-02-23,"Steve becomes a mentor for a tough but charming inner-city 9-year-old, 3J, and discovers that, although smart, 3J is illiterate. At first, 3J rejects Steve's help."
Family Matters,2,7,19,Eau de love,1996-03-08,"When Steve casts a spell on Laura with a magical love potion, his lifelong quest for her may finally have a happy ending. Harriette and Carl's plans for a second honeymoon are thwarted."
Family Matters,2,7,20,Twinkle Toes Faldo,1996-03-15,Waldo enrolls in tap-dancing class to improve his agility. Carl must tell Laura some bad news about her college aspirations.
Family Matters,2,7,21,Scammed,1996-03-29,"Eddie and Waldo go to a bar where they think famous basketball players congregate, but they are astounded by the expensive bill."
Family Matters,2,7,22,Dream Date,1996-04-26,"When Laura and Steve both end up without dates for the senior prom, they decide to go with each other."
Family Matters,2,7,23,A Ham Is Born,1996-05-10,Carl lands the lead role in a movie while moonlighting as a security guard. Steve helps Richie create an artificial tornado for a science project.
Family Matters,2,7,24,Send in the Clone,1996-05-17,Steve invents a cloning machine and replicates himself. The clone causes havoc around the Winslow house until Steve explains what's going on.
Family Matters,2,8,1,Paris Vacation (1),1996-09-20,"Steve invents a device that transports himself, his clone and the Winslows to Paris, where romance blossoms for Laura, and Steve is held captive by a beautiful scientist."
Family Matters,2,8,2,Paris Vacation (2),1996-09-20,"Stefan poses as a model for a French version of Coca-Cola and decided that modeling is his career choice. He makes his successful debut in the runway show. Meanwhile, Steve is taken with Nicole to Gilbert where he learns about her cousin's intentions to get filthy rich."
Family Matters,2,8,3,Paris Vacation (3),1996-09-27,"In Paris, Steve must escape from kidnappers who want his latest invention. He and Carl lead his pursuers on a wild chase that ends with Steve hanging from the Eiffel Tower."
Family Matters,2,8,4,Movin' On,1996-10-04,"On his first day of college, Steve finds something he's never experienced before: popularity!"
Family Matters,2,8,5,3J in the House,1996-10-11,The Winslows realize their true feelings for 3J when he runs away from his group home.
Family Matters,2,8,6,Getting Buff,1996-10-18,"Steve finds himself in an uncomfortable position when Eddie's longtime girlfriend models nude for Steve's sculpting class."
Family Matters,2,8,7,Stevil,1996-10-25,"Steve's ventriloquist dummy comes to life on Halloween, wreaking havoc in the Winslow household."
Family Matters,2,8,8,Karate Kids,1996-11-01,"Steve takes a job as a playground supervisor and is threatened by some tough bullies, but Steve transforms himself, 3J and Harriette's young nephew Richie into martial arts experts."
Family Matters,2,8,9,Home Again,1996-11-08,"To mend his long-distance relationship with Laura, Stefan visits from Paris and performs in a concert with the popular singing group New Edition."
Family Matters,2,8,10,Nightmare at Urkel Oaks,1996-11-15,Eddie dreams that he is married to Steve's Southern-belle cousin.
Family Matters,2,8,11,Chick-a-Boom,1996-11-22,"Carl hosts a dinner party for his superiors. Since he cannot afford to pay a caterer, Carl hires Myra to cook."
Family Matters,2,8,12,The Jury,1996-12-06,Steve must prove a defendant innocent when he and Carl serve on a jury together.
Family Matters,2,8,13,It Came Upon a Midnight Clear,1996-12-13,"While searching for the perfect Christmas tree, Carl and Steve get stranded in a remote forest."
Family Matters,2,8,14,Revenge of the Nerd,1997-01-03,Laura is excited about joining a sorority until she learns Steve has been named the star of its annual geek party.
Family Matters,2,8,15,Love Triangles,1997-01-17,"When Steve transports Carl back in time, Carl learns a valuable lesson about priorities."
Family Matters,2,8,16,Father Time,1997-01-31,"When Laura encourages her good friend Maxine to date more, Maxine dates Curtis. Despite the fact that she is now dating Stefan, Laura is jealous."
Family Matters,2,8,17,Beauty and the Beast,1997-02-07,"Harriette serves as the chairperson for a beauty pageant and convinces Laura, Maxine, Myra and Greta to participate."
Family Matters,2,8,18,Le Jour d'amour,1997-02-14,"Steve narrates three tales of love, including Carl's attempts to 'recycle' Harriette's Valentine's Day card."
Family Matters,2,8,19,What Do You Know?,1997-02-28,"Eddie is chosen as a contestant on a television game show and given the chance to win a car, but he realizes that he is not smart enough to answer the difficult questions."
Family Matters,2,8,20,Odd Man In,1997-03-14,Carl needs one more person for his poker-playing group. Harriette joins--and beats everyone.
Family Matters,2,8,21,Flirting with Disaster,1997-03-28,"Because of Steve's frequent calamities, insurance adjuster Mr. Tolbert threatens to raise Carl's homeowner's insurance."
Family Matters,2,8,22,Pound Foolish,1997-04-25,"Steve's Aunt Oona is very fat, but when she sings in the church choir, the Reverend asks her on a date."
Family Matters,2,8,23,The Brother Who Came to Dinner,1997-05-02,"Carl's fugitive brother visits unexpectedly, and Carl's boss wants Carl to arrest his brother."
Family Matters,2,8,24,A Pirate's Life for Me,1997-05-09,Steve uses his time-travel machine to transport himself and Carl back to a pirate ship in the year 1704.
